id	authors	date	title	journal	doi
https://www.zotero.org/groups/bat_literature_project/items/QV6C99H6	Wimsatt | Villa‐R	1970	Locomotor adaptations in the disc‐winged bat <i>Thyroptera tricolor</i> . I. Functional organization of the adhesive discs	American Journal of Anatomy	10.1002/aja.1001290107
https://www.zotero.org/groups/bat_literature_project/items/8Y5L4PY9	Leach | Bett | Said | Bukachi | Sang | Anderson | Machila | Kuleszo | Schaten | Dzingirai | Mangwanya | Ntiamoa-Baidu | Lawson | Amponsah-Mensah | Moses Lina | Wilkinson | Grant Donald | Koninga	May 6, 2019	Local disease-ecosystem-livelihood dynamics: reflections from comparative case studies in Africa	Philosophical Transactions of the Royal Society B: Biological Sciences	10.1098/rstb.2016.0163
https://www.zotero.org/groups/bat_literature_project/items/BQ82AD5N	van Toor | O'Mara | Abedi-Lartey | Wikelski | Fahr | Dechmann	April 2, 2019	Linking colony size with quantitative estimates of ecosystem services of African fruit bats	Current Biology	10.1016/j.cub.2019.02.033
https://www.zotero.org/groups/bat_literature_project/items/EHESKAK5	Hensley | Wilkins	1988	Leptonycteris nivalis	Mammalian Species	10.2307/3504229
https://www.zotero.org/groups/bat_literature_project/items/HJBGYXQS	Graham	1988	Interspecific Associations among Peruvian Bats at Diurnal Roosts and Roost Sites	Journal of Mammalogy	10.2307/1381626
https://www.zotero.org/groups/bat_literature_project/items/NLZIKVTL	Subudhi | Rapin | Misra | Subudhi | Rapin | Misra	2019-02-23	Immune System Modulation and Viral Persistence in Bats: Understanding Viral Spillover	Viruses	10.3390/v11020192
https://www.zotero.org/groups/bat_literature_project/items/8LLGG7TL	Lam | Shum | Zhu | Tong | Ni | Liao | Wei | Cheung | Li | Li | Leung | Holmes | Hu | Guan	Mar 26, 2020	Identifying SARS-CoV-2 related coronaviruses in Malayan pangolins	Nature	10.1038/s41586-020-2169-0
https://www.zotero.org/groups/bat_literature_project/items/KLARDFWB	Rihtaric | Hostnik | Steyer | Grom | Toplak	Apr 2010	Identification of SARS-like coronaviruses in horseshoe bats (Rhinolophus hipposideros) in Slovenia	Archives of Virology	10.1007/s00705-010-0612-5
https://www.zotero.org/groups/bat_literature_project/items/Z9TWZ4RZ	Quan | Firth | Street | Henriquez | Petrosov | Tashmukhamedova | Hutchison | Egholm | Osinubi | Niezgoda | Ogunkoya | Briese | Rupprecht | Lipkin	Oct 12, 2010	Identification of a severe acute respiratory syndrome coronavirus-like virus in a leaf-nosed bat in Nigeria	mBio	10.1128/mBio.00208-10
https://www.zotero.org/groups/bat_literature_project/items/W92DGTU4	Thuiller | Richardson | Rouget | Procheş | Wilson	07/2006	INTERACTIONS BETWEEN ENVIRONMENT, SPECIES TRAITS, AND HUMAN USES DESCRIBE PATTERNS OF PLANT INVASIONS	Ecology	10.1890/0012-9658(2006)87[1755:IBESTA]2.0.CO;2
https://www.zotero.org/groups/bat_literature_project/items/JPLIS58T	Neill | Kading	2021-09-24	Investigations on Vector-Borne and Aerosol Transmission Potential of Kaeng Khoi Virus in Cave-Dwelling Wrinkle-Lipped Free-Tailed Bats (Chaerephon plicatus) in Thailand	Microorganisms	10.3390/microorganisms9102022
https://www.zotero.org/groups/bat_literature_project/items/RAPNF6SZ	Plowright | Reaser | Locke | Woodley | Patz | Becker | Oppler | Hudson | Tabor	04/2021	Land use-induced spillover: a call to action to safeguard environmental, animal, and human health	The Lancet Planetary Health	10.1016/S2542-5196(21)00031-0
https://www.zotero.org/groups/bat_literature_project/items/DJ38ZXTW	Xiao | Zhai | Feng | Zhou | Zhang | Zou | Li | Guo | Li | Shen | Zhang | Shu | Huang | Li | Zhang | Chen | Wu | Peng | Huang | Xie | Cai | Hou | Chen | Xiao | Shen	2020-07	Isolation of SARS-CoV-2-related coronavirus from Malayan pangolins	Nature	10.1038/s41586-020-2313-x
https://www.zotero.org/groups/bat_literature_project/items/TD6SJN8P	Stoner	2000	Leaf selection by the tent-making bat <i>Artibeus watsoni</i> in <i>Asterogyne martiana</i> palms in southwestern Costa Rica	Journal of Tropical Ecology	10.1017/S0266467400001322
https://www.zotero.org/groups/bat_literature_project/items/SRBMZT7V	Myers	02/1960	Lasiurus from Missouri Caves	Journal of Mammalogy	10.2307/1376526
https://www.zotero.org/groups/bat_literature_project/items/NTWEQYIY	Suu-Ire | Fooks | Banyard | Selden | Amponsah-Mensah | Riesle | Ziekah | Ntiamoa-Baidu | Wood | Cunningham	2017/9	Lagos Bat Virus Infection Dynamics in Free-Ranging Straw-Colored Fruit Bats (Eidolon helvum)	Tropical Medicine and Infectious Disease	10.3390/tropicalmed2030025
https://www.zotero.org/groups/bat_literature_project/items/FYJMBPUX	Pourrut | Souris | Towner | Rollin | Nichol | Gonzalez | Leroy	2009	Large serological survey showing cocirculation of Ebola and Marburg viruses in Gabonese bat populations, and a high seroprevalence of both viruses in Rousettus aegyptiacus	BMC infectious diseases	10.1186/1471-2334-9-159
https://www.zotero.org/groups/bat_literature_project/items/TE9BTH7L	Ruadreo | Voigt | Bumrungsri	2019-2-14	Large Dietary Niche Overlap of Sympatric Open-space Foraging Bats Revealed by Carbon and Nitrogen Stable Isotopes	Acta Chiropterologica	10.3161/15081109ACC2018.20.2.005
https://www.zotero.org/groups/bat_literature_project/items/TA3K6ZMQ	Thomas	1993	Lack of evidence for a biological alarm clock in bats ( <i>Myotis</i> spp.) hibernating under natural conditions	Canadian Journal of Zoology	10.1139/z93-001
https://www.zotero.org/groups/bat_literature_project/items/8C78PQA7	Gbogbo | Kyei	2017	Knowledge, perceptions and attitude of a community living around a colony of straw-coloured fruit bats (Eidolon helvum) in Ghana after Ebola virus disease outbreak in West Africa	Zoonoses and Public Health	10.1111/zph.12357
https://www.zotero.org/groups/bat_literature_project/items/7I64KDI3	Kandeil | Gomaa | Shehata | El Taweel | Mahmoud | Bagato | Moatasim | Kutkat | Kayed | Dawson | Qiu | Bahl | Webby | Karesh | Kayali | Ali	2019 Jan 15	Isolation and Characterization of a Distinct Influenza A Virus from Egyptian Bats	J Virol	10.1128/JVI.01059-18
https://www.zotero.org/groups/bat_literature_project/items/FAXUVMSD	Lacroix | Mbala Kingebeni | Ndimbo Kumugo | Lempu | Butel | Serrano | Vidal | Thaurignac | Esteban | Mukadi Bamuleka | Likofata | Delaporte | Muyembe Tamfum | Ayouba | Peeters | Ahuka Mundeke	May 4 2021	Investigating the Circulation of Ebola Viruses in Bats during the Ebola Virus Disease Outbreaks in the Equateur and North Kivu Provinces of the Democratic Republic of Congo from 2018	Pathogens	10.3390/pathogens10050557
https://www.zotero.org/groups/bat_literature_project/items/Y4CTI4VF	Nesi | Tsagkogeorga | Tsang | Nicolas | Lalis | Scanlon | Riesle-Sbarbaro | Wiantoro | Hitch | Juste | Pinzari | Bonaccorso | Todd | Lim | Simmons | McGowen | Rossiter	March 4, 2021	Interrogating Phylogenetic Discordance Resolves Deep Splits in the Rapid Radiation of Old World Fruit Bats (Chiroptera: Pteropodidae)	Systematic Biology	10.1093/sysbio/syab013
https://www.zotero.org/groups/bat_literature_project/items/72HNVD3W	Leopardi | Holmes | Gastaldelli | Tassoni | Priori | Scaravelli | Zamperin | De Benedictis	2018 Mar	Interplay between co-divergence and cross-species transmission in the evolutionary history of bat coronaviruses	Infect Genet Evol	10.1016/j.meegid.2018.01.012
https://www.zotero.org/groups/bat_literature_project/items/876PMS2N	Pavan | Marroig	10/2016	Integrating multiple evidences in taxonomy: species diversity and phylogeny of mustached bats (Mormoopidae: Pteronotus)	Molecular Phylogenetics and Evolution	10.1016/j.ympev.2016.07.011
https://www.zotero.org/groups/bat_literature_project/items/6CAG838X	Maceda-Veiga | Figuerola | Martínez-Silvestre | Viscor | Ferrari | Pacheco	2015-05-01	Inside the Redbox: applications of haematology in wildlife monitoring and ecosystem health assessment	The Science of the Total Environment	10.1016/j.scitotenv.2015.02.004
https://www.zotero.org/groups/bat_literature_project/items/5FRPQ8MX	Upham | Esselstyn | Jetz	Dec 4, 2019	Inferring the mammal tree: Species-level sets of phylogenies for questions in ecology, evolution, and conservation	PLOS Biology	10.1371/journal.pbio.3000494
https://www.zotero.org/groups/bat_literature_project/items/7JUJT6GY	Hassanin | Tu | Curaudeau | Csorba	2021-07-12	Inferring the ecological niche of bat viruses closely related to SARS-CoV-2 using phylogeographic analyses of Rhinolophus species	Scientific Reports	10.1038/s41598-021-93738-z
https://www.zotero.org/groups/bat_literature_project/items/RJPH2D8A	Duarte | Alencar | Cavalcante | Correia | Romijn | Araujo | Favoretto | Heukelbach	03/2020	Increased detection of rabies virus in bats in Ceará State (Northeast Brazil) after implementation of a passive surveillance programme	Zoonoses and Public Health	10.1111/zph.12670
https://www.zotero.org/groups/bat_literature_project/items/2AK7Q2HC	Howe	1984	Implications of seed dispersal by animals for tropical reserve management	Biological Conservation	10.1016/0006-3207(84)90087-9
https://www.zotero.org/groups/bat_literature_project/items/22WZWTKA	Edwards | Xi | Janke | Faircloth | McCormack | Glenn | Zhong | Wu | Lemmon | Lemmon | Leaché | Liu | Davis	01/2016	Implementing and testing the multispecies coalescent model: A valuable paradigm for phylogenomics	Molecular Phylogenetics and Evolution	10.1016/j.ympev.2015.10.027
https://www.zotero.org/groups/bat_literature_project/items/UZ7N5QRK	Meredith | Janečka | Gatesy | Ryder | Fisher | Teeling | Goodbla | Eizirik | Simão | Stadler | Rabosky | Honeycutt | Flynn | Ingram | Steiner | Williams | Robinson | Burk-Herrick | Westerman | Ayoub | Springer | Murphy	2011-10-28	Impacts of the Cretaceous Terrestrial Revolution and KPg Extinction on Mammal Diversification	Science	10.1126/science.1211028
https://www.zotero.org/groups/bat_literature_project/items/Z8HYVNMV	Schountz	2014	Immunology of bats and their viruses: Challenges and opportunities	Viruses	10.3390/v6124880
https://www.zotero.org/groups/bat_literature_project/items/ZZ9QEIXG	Schountz | Baker | Butler | Munster	2017	Immunological Control of Viral Infections in Bats and the Emergence of Viruses Highly Pathogenic to Humans	Frontiers in Immunology	10.3389/fimmu.2017.01098
https://www.zotero.org/groups/bat_literature_project/items/9N35QQB6	Schneeberger | Courtiol | Czirj??k | Voigt	2014	Immune profile predicts survival and reflects senescence in a small, long-lived mammal, the greater sac-winged bat (Saccopteryx bilineata)	PLoS ONE	10.1371/journal.pone.0108268
https://www.zotero.org/groups/bat_literature_project/items/HC8DFTEA	Poon | Chu | Chan | Wong | Ellis | Leung | Lau | Woo | Suen | Yuen | Guan | Peiris	Feb 2005	Identification of a novel coronavirus in bats	Journal of Virology	10.1128/JVI.79.4.2001-2009.2005
https://www.zotero.org/groups/bat_literature_project/items/EHZ6RGS3	Euren | Bangura | Gbakima | Sinah | Yonda | Lange | McIver | LeBreton | Wolking | Grigorescu Monagin | Bird | Saylors	2020-09	Human Interactions with Bat Populations in Bombali, Sierra Leone	EcoHealth	10.1007/s10393-020-01502-y
https://www.zotero.org/groups/bat_literature_project/items/P92FE9YM	Murray | Daszak	Feb 2013	Human ecology in pathogenic landscapes: two hypotheses on how land use change drives viral emergence	Current Opinion in Virology	10.1016/j.coviro.2013.01.006
https://www.zotero.org/groups/bat_literature_project/items/5IRYI2Q5	Rimoin | Alfonso | Hoff | Doshi | Mulembakani | Kisalu | Muyembe | Okitolonda | Wright	2017-09	Human Exposure to Wild Animals in the Sankuru Province of the Democratic Republic of the Congo	EcoHealth	10.1007/s10393-017-1262-9
https://www.zotero.org/groups/bat_literature_project/items/7GQ3RHQG	Peel | Wood | Baker | Breed | Carvalho | Fernández-Loras | Gabrieli | Gembu | Kakengi | Kaliba | Kityo | Lembo | Mba | Ramos | Rodriguez-Prieto | Suu-Ire | Cunningham | Hayman	2017/06	How Does Africa's Most Hunted Bat Vary Across the Continent? Population Traits of the Straw-Coloured Fruit Bat (Eidolon helvum) and Its Interactions with Humans	Acta Chiropterologica	10.3161/15081109ACC2017.19.1.006
https://www.zotero.org/groups/bat_literature_project/items/5KD2YTX6	Feijó | Rocha | Ferrari	2015	HOW DO WE IDENTIFY MICRONYCTERIS (SCHIZONYCETRIS) SANBORNI SIMMONS, 1996 (CHIROPTERA, PHYLLOSTOMIDAE) RELIABLY AND WHERE WE CAN FIND THIS SPECIES IN BRAZIL?	Papéis Avulsos de Zoologia (São Paulo)	10.1590/0031-1049.2015.55.20
https://www.zotero.org/groups/bat_literature_project/items/B9V6SIKV	Foley | Thong | Soisook | Goodman | Armstrong | Jacobs | Puechmaille | Teeling	2015-02	How and Why Overcome the Impediments to Resolution: Lessons from rhinolophid and hipposiderid Bats	Molecular Biology and Evolution	10.1093/molbev/msu329
https://www.zotero.org/groups/bat_literature_project/items/ZKTX77JG	Streicker | Turmelle | Vonhof | Kuzmin | McCracken | Rupprecht	2010-08-06	Host Phylogeny Constrains Cross-Species Emergence and Establishment of Rabies Virus in Bats	Science	10.1126/science.1188836
https://www.zotero.org/groups/bat_literature_project/items/HK5ZSJCH	Olival | Hosseini | Zambrana-Torrelio | Ross | Bogich | Daszak	06 29, 2017	Host and viral traits predict zoonotic spillover from mammals	Nature	10.1038/nature22975
https://www.zotero.org/groups/bat_literature_project/items/RFXYAC6D	Winkelmann | Bonaccorso | Strickler	2000	HOME RANGE OF THE SOUTHERN BLOSSOM BAT, <i>SYCONYCTERIS AUSTRALIS,</i> IN PAPUA NEW GUINEA	Journal of Mammalogy	10.1644/1545-1542(2000)081<0408:HROTSB>2.0.CO;2
https://www.zotero.org/groups/bat_literature_project/items/L5HVZI6M	Moore | Reichard | Murtha | Nabhan | Pian | Ferreira | Kunz	2013	Hibernating Little Brown Myotis (<i>Myotis lucifugus</i>) Show Variable Immunological Responses to White-Nose Syndrome	PLoS ONE	10.1371/journal.pone.0058976
https://www.zotero.org/groups/bat_literature_project/items/CVJEMHFV	Schaer | Perkins | Decher | Leendertz | Fahr | Weber | Matuschewski	2013	High diversity of West African bat malaria parasites and a tight link with rodent Plasmodium taxa	Proceedings of the National Academy of Sciences	10.1073/pnas.1311016110
https://www.zotero.org/groups/bat_literature_project/item